{
  "$schema": "../../../schemas/documents/document.memory_manufacturing-data-business-investment.schema.json",
  "schema_version": "1.0.0",
  "id": "document.memory_manufacturing",
  "record_type": "document-section",
  "data": {
    "capital_schedule": [
      {
        "quarter": "1979-Q1",
        "usd": 180000,
        "purpose": "Stepper programme facilities and procurement; commissioned 1979-Q4"
      },
      {
        "quarter": "1979-Q2",
        "usd": 450000,
        "purpose": "First GCA stepper and bay installation; commissioned 1979-Q4"
      },
      {
        "quarter": "1979-Q3",
        "usd": 420000,
        "purpose": "Reticle, metrology and process integration equipment; commissioned 1979-Q4"
      },
      {
        "quarter": "1980-Q1",
        "usd": 325000,
        "purpose": "Matched second stepper procurement; commissioned 1980-Q2"
      },
      {
        "quarter": "1980-Q2",
        "usd": 300000,
        "purpose": "Second stepper acceptance, matching and support; commissioned 1980-Q2"
      },
      {
        "quarter": "1980-Q3",
        "usd": 125000,
        "purpose": "Memory laser repair/test equipment; commissioned 1981-Q1"
      },
      {
        "quarter": "1980-Q4",
        "usd": 125000,
        "purpose": "Memory repair installation and acceptance; commissioned 1981-Q1"
      },
      {
        "quarter": "1981-Q3",
        "usd": 150000,
        "purpose": "2 um etch/metrology upgrade; commissioned 1982-Q2"
      },
      {
        "quarter": "1981-Q4",
        "usd": 150000,
        "purpose": "2 um process equipment; commissioned 1982-Q2"
      },
      {
        "quarter": "1982-Q1",
        "usd": 150000,
        "purpose": "2 um equipment installation; commissioned 1982-Q2"
      },
      {
        "quarter": "1982-Q2",
        "usd": 150000,
        "purpose": "2 um process acceptance; commissioned 1982-Q2"
      },
      {
        "quarter": "1982-Q3",
        "usd": 200000,
        "purpose": "1.5 um equipment and metrology upgrade; commissioned 1983-Q3"
      },
      {
        "quarter": "1982-Q4",
        "usd": 200000,
        "purpose": "1.5 um equipment procurement; commissioned 1983-Q3"
      },
      {
        "quarter": "1983-Q1",
        "usd": 200000,
        "purpose": "1.5 um optics/alignment/process upgrade; commissioned 1983-Q3"
      },
      {
        "quarter": "1983-Q2",
        "usd": 200000,
        "purpose": "1.5 um installation; commissioned 1983-Q3"
      },
      {
        "quarter": "1983-Q3",
        "usd": 200000,
        "purpose": "1.5 um qualification equipment; commissioned 1983-Q3"
      },
      {
        "quarter": "1983-Q4",
        "usd": 200000,
        "purpose": "1.5 um selected release and matching; commissioned 1983-Q4"
      }
    ],
    "capital_basis": "Nominal USD engineering allowances, not quotations. Full added programme excludes demand-driven legacy fab capacity, which is recomputed independently. Future capital after 1981 is disclosed separately from closed-horizon ROI.",
    "engineering_programs": [
      {
        "id": "stepper_process_development",
        "entity": "AION Labs",
        "start": "1979-Q1",
        "end": "1981-Q4",
        "person_months": 180,
        "product_refs": [
          "technology.nmos_275um"
        ],
        "scope": "Incremental stepper process, reticles, metrology, matching and RAM shrink trials; excludes existing 120 PM original 64K programme."
      },
      {
        "id": "dram_redundancy",
        "entity": "AION Labs",
        "start": "1980-Q1",
        "end": "1980-Q4",
        "person_months": 60,
        "product_refs": [
          "part.aion_4164"
        ],
        "scope": "Spare rows/columns, fuses, defect maps, repair/retest, retention and reliability; repaired production target January 1981."
      },
      {
        "id": "pro_aion_memory_qualification",
        "entity": "Logix",
        "start": "1980-Q3",
        "end": "1981-Q2",
        "person_months": 24,
        "product_refs": [
          "computer.artemis_pro"
        ],
        "scope": "AION memory modules, full-bank timing/power/refresh and server qualification."
      }
    ],
    "future_engineering": [
      {
        "period": "1982",
        "person_months": 120,
        "loaded_payroll_and_validation_usd": 600000
      },
      {
        "period": "1983",
        "person_months": 144,
        "loaded_payroll_and_validation_usd": 780000
      }
    ],
    "future_engineering_basis": "Additional forward annual planning allowance; includes prototype/mask/validation work, excludes capital above and later volume operating cost. Not included in 1974–81 ROI."
  }
}
